{
  "source_summary": "用户素材涉及芒果超媒在4月15日举办AI内容创作大赛，12个团队参赛，一等奖作品《AI导演》实现全流程AI辅助制作。",
  "facts": {
    "time": [
      "4月15日"
    ],
    "location": [],
    "organizations": [
      "芒果超媒"
    ],
    "leaders": [],
    "persons": [],
    "products": [
      "《AI导演》"
    ],
    "projects": [],
    "events": [
      "AI内容创作大赛"
    ],
    "data": [
      "12个团队"
    ],
    "achievements": [
      "一等奖作品《AI导演》实现了全流程AI辅助制作"
    ],
    "problems": [],
    "requests": [],
    "policies": [],
    "documents": []
  },
  "fact_items": [
    {
      "type": "time",
      "value": "4月15日",
      "source_text": "4月15日，芒果超媒举办AI内容创作大赛。",
      "confidence": 0.98,
      "can_use_in_draft": true,
      "needs_manual_confirmation": false,
      "note": null
    },
    {
      "type": "organization",
      "value": "芒果超媒",
      "source_text": "4月15日，芒果超媒举办AI内容创作大赛。",
      "confidence": 0.96,
      "can_use_in_draft": true,
      "needs_manual_confirmation": false,
      "note": "extract阶段只抽取原文称谓，正式全称后续由口径库校验。"
    },
    {
      "type": "event",
      "value": "AI内容创作大赛",
      "source_text": "4月15日，芒果超媒举办AI内容创作大赛。",
      "confidence": 0.97,
      "can_use_in_draft": true,
      "needs_manual_confirmation": false,
      "note": null
    },
    {
      "type": "data",
      "value": "12个团队",
      "source_text": "来自12个团队参加。",
      "confidence": 0.95,
      "can_use_in_draft": true,
      "needs_manual_confirmation": false,
      "note": null
    },
    {
      "type": "product",
      "value": "《AI导演》",
      "source_text": "一等奖作品《AI导演》实现了全流程AI辅助制作。",
      "confidence": 0.97,
      "can_use_in_draft": true,
      "needs_manual_confirmation": false,
      "note": null
    },
    {
      "type": "achievement",
      "value": "一等奖作品《AI导演》实现了全流程AI辅助制作",
      "source_text": "一等奖作品《AI导演》实现了全流程AI辅助制作。",
      "confidence": 0.96,
      "can_use_in_draft": true,
      "needs_manual_confirmation": false,
      "note": "具体实现细节未提供，不得自行补充。"
    }
  ],
  "missing_fields": [
    {
      "field": "活动举办地点",
      "reason": "用户初稿未提供活动举办地点",
      "impact": "影响新闻稿背景信息的完整性",
      "suggestion": "后续写作可概括为'在芒果超媒举办'或补充具体地点"
    },
    {
      "field": "参赛团队具体信息",
      "reason": "用户只提到12个团队，未提供团队名称或代表性团队",
      "impact": "影响新闻稿内容的丰富性",
      "suggestion": "可概括表述，不编造"
    }
  ],
  "cannot_infer": [
    {
      "field": "领导出席情况",
      "reason": "用户素材未提供领导出席信息，不得自动补充"
    },
    {
      "field": "领导评价",
      "reason": "用户素材未提供领导评价，不得自动写入"
    },
    {
      "field": "活动影响",
      "reason": "用户素材未提供活动影响、传播效果或社会反响"
    }
  ],
  "risk_flags": [
    {
      "type": "event_without_time_location",
      "detail": "活动提供了时间，但未提供具体地点",
      "level": "medium"
    }
  ],
  "extraction_policy": {
    "only_user_provided_facts": true,
    "no_external_knowledge": true,
    "no_rag_facts": true,
    "no_invented_data": true
  }
}