{
  "source_summary": "用户素材涉及一场文化科技融合创新活动，包含时间、地点、参与单位和成果发布信息。",
  "facts": {
    "time": [
      "5月20日"
    ],
    "location": [
      "马栏山"
    ],
    "organizations": [
      "湖南广电集团",
      "芒果超媒"
    ],
    "leaders": [],
    "persons": [
      "多家单位的代表"
    ],
    "products": [],
    "projects": [],
    "events": [
      "文化科技融合创新活动"
    ],
    "data": [
      "三项"
    ],
    "achievements": [
      "活动现场发布了三项创新成果"
    ],
    "problems": [],
    "requests": [],
    "policies": [],
    "documents": []
  },
  "fact_items": [
    {
      "type": "time",
      "value": "5月20日",
      "source_text": "5月20日，文化科技融合创新活动在马栏山举行。",
      "confidence": 0.98,
      "can_use_in_draft": true,
      "needs_manual_confirmation": false,
      "note": null
    },
    {
      "type": "location",
      "value": "马栏山",
      "source_text": "文化科技融合创新活动在马栏山举行。",
      "confidence": 0.98,
      "can_use_in_draft": true,
      "needs_manual_confirmation": false,
      "note": null
    },
    {
      "type": "organization",
      "value": "湖南广电集团",
      "source_text": "来自湖南广电集团、芒果超媒等单位的代表参加交流。",
      "confidence": 0.96,
      "can_use_in_draft": true,
      "needs_manual_confirmation": false,
      "note": "extract阶段只抽取原文称谓，正式全称后续由口径库校验。"
    },
    {
      "type": "organization",
      "value": "芒果超媒",
      "source_text": "来自湖南广电集团、芒果超媒等单位的代表参加交流。",
      "confidence": 0.96,
      "can_use_in_draft": true,
      "needs_manual_confirmation": false,
      "note": "extract阶段只抽取原文称谓，正式全称后续由口径库校验。"
    },
    {
      "type": "event",
      "value": "文化科技融合创新活动",
      "source_text": "5月20日，文化科技融合创新活动在马栏山举行。",
      "confidence": 0.95,
      "can_use_in_draft": true,
      "needs_manual_confirmation": false,
      "note": null
    },
    {
      "type": "achievement",
      "value": "活动现场发布了三项创新成果",
      "source_text": "活动现场发布了三项创新成果。",
      "confidence": 0.94,
      "can_use_in_draft": true,
      "needs_manual_confirmation": false,
      "note": "成果名称未提供，不得自行补充。"
    }
  ],
  "missing_fields": [
    {
      "field": "成果具体名称",
      "reason": "用户只说明发布三项创新成果，未提供成果名称",
      "impact": "影响新闻稿主体内容的具体性",
      "suggestion": "后续写作可概括表述，不得编造具体成果名称"
    }
  ],
  "cannot_infer": [
    {
      "field": "领导出席情况",
      "reason": "用户素材未提供领导出席信息，不得自动补充"
    },
    {
      "field": "领导评价",
      "reason": "用户素材未提供领导评价，不得自动写入'领导高度肯定'等表述"
    },
    {
      "field": "媒体传播效果",
      "reason": "用户素材未提供媒体报道、传播数据或社会反响"
    }
  ],
  "risk_flags": [
    {
      "type": "achievement_without_detail",
      "detail": "素材提到三项创新成果，但未提供成果具体名称",
      "level": "medium"
    }
  ],
  "extraction_policy": {
    "only_user_provided_facts": true,
    "no_external_knowledge": true,
    "no_rag_facts": true,
    "no_invented_data": true
  }
}