{
  "source_summary": "用户初稿描述了一场AI内容创作大赛，包含时间、主办方、参赛规模和获奖作品信息。",
  "facts": {
    "time": [
      "4月15日"
    ],
    "location": [],
    "organizations": [
      "芒果超媒"
    ],
    "leaders": [],
    "persons": [],
    "products": [
      "《AI导演》"
    ],
    "projects": [],
    "events": [
      "AI内容创作大赛"
    ],
    "data": [
      "12个团队"
    ],
    "achievements": [
      "一等奖作品《AI导演》实现了全流程AI辅助制作"
    ],
    "problems": [],
    "requests": [],
    "policies": [],
    "documents": []
  },
  "fact_items": [
    {
      "type": "time",
      "value": "4月15日",
      "source_text": "4月15日，芒果超媒举办AI内容创作大赛。",
      "confidence": 0.98,
      "can_use_in_draft": true,
      "needs_manual_confirmation": false,
      "note": null
    },
    {
      "type": "organization",
      "value": "芒果超媒",
      "source_text": "4月15日，芒果超媒举办AI内容创作大赛。",
      "confidence": 0.98,
      "can_use_in_draft": true,
      "needs_manual_confirmation": false,
      "note": "extract阶段只抽取原文称谓，正式全称后续由口径库校验。"
    },
    {
      "type": "event",
      "value": "AI内容创作大赛",
      "source_text": "4月15日，芒果超媒举办AI内容创作大赛。",
      "confidence": 0.98,
      "can_use_in_draft": true,
      "needs_manual_confirmation": false,
      "note": null
    },
    {
      "type": "data",
      "value": "12个团队",
      "source_text": "来自12个团队参加。",
      "confidence": 0.98,
      "can_use_in_draft": true,
      "needs_manual_confirmation": false,
      "note": null
    },
    {
      "type": "product",
      "value": "《AI导演》",
      "source_text": "一等奖作品《AI导演》实现了全流程AI辅助制作。",
      "confidence": 0.98,
      "can_use_in_draft": true,
      "needs_manual_confirmation": false,
      "note": null
    },
    {
      "type": "achievement",
      "value": "一等奖作品《AI导演》实现了全流程AI辅助制作",
      "source_text": "一等奖作品《AI导演》实现了全流程AI辅助制作。",
      "confidence": 0.95,
      "can_use_in_draft": true,
      "needs_manual_confirmation": false,
      "note": "作品名称已提供，但未提供具体实现细节。"
    }
  ],
  "missing_fields": [
    {
      "field": "活动地点",
      "reason": "用户未提供活动举办地点",
      "impact": "影响新闻稿地点要素完整性",
      "suggestion": "后续写作前建议确认活动地点"
    },
    {
      "field": "获奖作品具体细节",
      "reason": "用户只说明一等奖作品实现了全流程AI辅助制作，未提供具体技术或团队成员",
      "impact": "影响内容深度",
      "suggestion": "可后续补充"
    },
    {
      "field": "参赛团队详情",
      "reason": "用户只提供团队数量，未提供团队名称或来源",
      "impact": "影响报道丰富性",
      "suggestion": "可后续补充"
    }
  ],
  "cannot_infer": [
    {
      "field": "领导出席情况",
      "reason": "用户素材未提供领导出席信息，不得自动补充"
    },
    {
      "field": "领导评价",
      "reason": "用户素材未提供领导评价，不得自动写入"
    },
    {
      "field": "活动影响",
      "reason": "用户素材未提供活动影响或传播效果"
    },
    {
      "field": "一等奖作品具体技术细节",
      "reason": "用户未提供，不得自行补充"
    }
  ],
  "risk_flags": [
    {
      "type": "event_without_time_location",
      "detail": "活动缺少地点信息",
      "level": "medium"
    },
    {
      "type": "achievement_without_data",
      "detail": "获奖作品成就未提供具体数据支撑（如效率提升比例等）",
      "level": "medium"
    },
    {
      "type": "incomplete_organization_name",
      "detail": "组织机构名称以简称形式出现（芒果超媒），可能缺少全称",
      "level": "low"
    }
  ],
  "extraction_policy": {
    "only_user_provided_facts": true,
    "no_external_knowledge": true,
    "no_rag_facts": true,
    "no_invented_data": true
  }
}